movie_id,title,original_title,original_language,overview,tagline,status,homepage,imdb_id,runtime,budget,revenue,popularity,vote_average,vote_count,release_date,adult,video,poster_path,backdrop_path,collection_id,collection_name,director,last_updated
27850,Halloweentown,Halloweentown,en,"On her 13th birthday, Marnie learns she's a witch, discovers a secret portal, and is transported to Halloweentown — a magical place where ghosts and ghouls, witches and werewolves live apart from the human world. But she soon finds herself battling wicked warlocks, evil curses, and endless surprises.","Monsters, goblins, ghosts, and vampires, and gnomes, and skeletons.",Released,https://movies.disney.com/halloweentown,tt0173886,84,0,0,4.7565,6.815,588,1998-11-10,False,False,/y9RJCxJMbWqhXjkBgC0VXETmHj6.jpg,/dOaF7zNAHYsSaAp8PXrUt4qfm8k.jpg,87252,Halloweentown Collection,Duwayne Dunham,2026-04-20 18:18:00.065771
5994,The Family Man,The Family Man,en,"Jack's lavish, fast-paced lifestyle changes one Christmas night when he stumbles into a grocery store holdup and disarms the gunman. The next morning he wakes up in bed lying next to Kate, his college sweetheart he left in order to pursue his career, and to the horrifying discovery that his former life no longer exists. As he stumbles through this alternate suburban universe, Jack finds himself at a crossroad where he must choose between his high-power career and the woman he loves.","What if you made different choices? What if you said yes, instead of no? What if you got a second chance?",Released,,tt0218967,125,60000000,124700000,8.4757,6.814,2186,2000-12-12,False,False,/9wToOVsKuf0XeKhlauzCa3D8Gui.jpg,/gnosJeDIDQXy9uDewXphEpDWNYT.jpg,,,Brett Ratner,2026-04-20 18:18:00.488249
13682,Pooh's Heffalump Movie,Pooh's Heffalump Movie,en,"Who or what exactly is a Heffalump? The lovable residents of the Hundred Acre Wood -- Winnie the Pooh, Rabbit, Tigger, Eeyore, Kanga and the rest of the pack -- embark on a journey of discovery in search of the elusive Heffalump. But as is always the case, this unusual road trip opens their eyes to so much more than just the creature they're seeking.",Heffa nice day.,Released,,tt0407121,68,20000000,52900000,6.5464,6.813,488,2005-02-11,False,False,/5kd5JqccroxOnC9sVMP5NtLrbkr.jpg,/wUFgVDjkSlUwX6ehWhOsy6JSnCx.jpg,,,Frank Nissen,2026-04-20 18:18:01.228797
11497,All Dogs Go to Heaven,All Dogs Go to Heaven,en,"When a casino-owning dog named Charlie is murdered by his rival Carface, he finds himself in Heaven. Wanting to get back at his killer, he cons his way back to the living with the warning that doing so damns him to Hell. Once back, he teams with his old partner, Itchy, to prep his retaliation. He stumbles upon an orphan girl who can talk to the animals, thus allowing him to get the inside info on the races to ensure his wins to finance his plans. However, all the while, he is still haunted by nightmares of what's waiting for him on the other side unless he can prove that he is worthy of Heaven again.",But not all dogs stay there!,Released,,tt0096787,84,13800000,27100027,7.91,6.81,1121,1989-11-17,False,False,/nmWh1NglDinfkHD9zCNqGWyhl7Q.jpg,/haJ6SsjxfhSRG61LMy4QJWxCNAb.jpg,140910,All Dogs Go to Heaven Collection,Don Bluth,2026-04-20 18:18:01.639155
2300,Space Jam,Space Jam,en,"With their freedom on the line, the Looney Tunes seek the help of NBA superstar Michael Jordan to win a basketball game against a team of moronic aliens.",Get ready to jam.,Released,https://spacejam.com,tt0117705,87,80000000,250200000,8.0401,6.808,6370,1996-11-15,False,False,/4RN5El3Pj2W4gpwgiAGLVfSJv2g.jpg,/lWybXICZZpxnSvWSOW53XxTERUg.jpg,722961,Space Jam Collection,Joe Pytka,2026-04-20 18:18:02.040355
795,City of Angels,City of Angels,en,"When a guardian angel – who invisibly watches over the citizens of Los Angeles – becomes captivated by a strong-willed heart surgeon, he ponders trading in his pure, otherworldly existence for a mortal life with his beloved. The couple embarks on a tender but forbidden romance spanning heaven and Earth.",She didn't believe in angels until she fell in love with one.,Released,,tt0120632,114,55000000,198685114,7.4802,6.808,2323,1998-04-10,False,False,/iuzxpUjHsbQJXV3kB9ZAdCimM60.jpg,/pYl4YpepgRbr504D7ep58C5gMyF.jpg,,,Brad Silberling,2026-04-20 18:18:02.928081
9387,Conan the Barbarian,Conan the Barbarian,en,"A horde of rampaging warriors massacre the parents of young Conan and enslave the young child for years on The Wheel of Pain. As the sole survivor of the childhood massacre, Conan is released from slavery and taught the ancient arts of fighting. Transforming himself into a killing machine, Conan travels into the wilderness to seek vengeance on Thulsa Doom, the man responsible for killing his family. In the wilderness, Conan takes up with the thieves Valeria and Subotai. The group comes upon King Osric, who wants the trio of warriors to help rescue his daughter who has joined Doom in the hills.",Thief. Warrior. Gladiator. King.,Released,,tt0082198,130,20000000,68851475,8.8994,6.801,2763,1982-03-16,False,False,/qw2A587Ee61IwcSOLNFRhuOACZZ.jpg,/4rICId8WQBhOIzl7iZCVvc0QoJW.jpg,43055,Conan the Barbarian Collection,John Milius,2026-04-20 18:18:03.526137
759175,The Princess,The Princess,en,"A beautiful, strong-willed young royal refuses to wed the cruel sociopath to whom she is betrothed and is kidnapped and locked in a remote tower of her father’s castle. With her scorned, vindictive suitor intent on taking her father’s throne, the princess must protect her family and save the kingdom.",Bow to no one.,Released,https://www.20thcenturystudios.com/movies/the-princess,tt13406136,94,0,0,5.9421,6.801,845,2022-06-16,False,False,/9pCoqX24a6rE981fY1O3PmhiwrB.jpg,/5PnypKiSj2efSPqThNjTXz8jwOg.jpg,,,Le Van Kiet,2026-04-20 18:18:04.026513
18198,Barbie Mariposa,Barbie Mariposa,en,"Elina, heroine of the Fairytopia films tells her friend Bibble the story of Flutterfield, a faraway kingdom populated by fairies with butterfly wings. Henna, the evil butterfly fairy has poisoned the queen of Flutterfield in an attempt to take over the kingdom.",Soar to New Heights of Adventure!,Released,,tt1201561,75,0,0,5.1277,6.797,546,2008-02-26,False,False,/qsb1OQCNVMAX3KRT6xhKOl3mM6P.jpg,/crbYDGMpjE9eP6jBcNdSidvlc0n.jpg,447622,Barbie Mariposa Collection,Conrad Helten,2026-04-20 18:18:04.484421
1001865,Scrooge: A Christmas Carol,Scrooge: A Christmas Carol,en,"On a cold Christmas Eve, selfish miser Ebenezer Scrooge has one night left to face his past — and change the future — before time runs out.",,Released,https://www.netflix.com/title/81028225,tt20917338,97,0,0,5.3868,6.8,474,2022-11-18,False,False,/oyGb5JpEYMEqDDjfJKLEvPTVSjK.jpg,/wMNY6tU9WOUeAMRfqbCYwceOl9u.jpg,,,Stephen Donnelly,2026-04-20 18:18:04.790691
668482,Roald Dahl's Matilda the Musical,Roald Dahl's Matilda the Musical,en,"An extraordinary young girl discovers her superpower and summons the remarkable courage, against all odds, to help others change their stories, whilst also taking charge of her own destiny. Standing up for what's right, she's met with miraculous results.",Meet the exception to the rules.,Released,https://www.sonypictures.co.uk/movies/roald-dahls-matilda-musical,tt3447590,117,25000000,37289659,7.9648,6.791,809,2022-11-25,False,False,/ga8R3OiOMMgSvZ4cOj8x7prUNYZ.jpg,/jG52tsazn04F1fe8hPZfVv7ICKt.jpg,,,Matthew Warchus,2026-04-20 18:18:05.122757
1226863,The Super Mario Galaxy Movie,The Super Mario Galaxy Movie,en,"Having thwarted Bowser's previous plot to marry Princess Peach, Mario and Luigi now face a fresh threat in Bowser Jr., who is determined to liberate his father from captivity and restore the family legacy. Alongside companions new and old, the brothers travel across the stars to stop the young heir's crusade.",The galaxy awaits.,Released,https://www.thesupermariogalaxymovie.com,tt28650488,98,110000000,747400000,828.4621,6.789,529,2026-04-01,False,False,/eJGWx219ZcEMVQJhAgMiqo8tYY.jpg,/kxQiIJ4gVcD3K6o14MJ72p5yRcE.jpg,1434561,The Super Mario Collection,Aaron Horvath,2026-04-20 18:18:05.564106
16910,Naruto the Movie: Legend of the Stone of Gelel,劇場版 NARUTO -ナルト- 大激突!幻の地底遺跡だってばよ,ja,"Naruto, Shikamaru, and Sakura are executing their mission of delivering a lost pet to a certain village. However, right in the midst of things, troops led by the mysterious knight, Temujin, attack them. In the violent battle, the three become separated. Temujin challenges Naruto to a fight and at the end of the fierce battle, both fall together from a high cliff...",,Released,http://pierrot.jp/title/naruto/movie2005/index.html,tt0791188,97,0,10198805,5.4142,6.789,432,2005-08-06,False,False,/itKMldwL6uhUZYO3X78NOFU4zzO.jpg,/ldwWnaWoW8ziEFflimoraZouyvB.jpg,23616,Naruto Collection,Hirotsugu Kawasaki,2026-04-20 18:18:05.950975
11319,The Rescuers,The Rescuers,en,Two agents of the mouse-run International Rescue Aid Society search for a little orphan girl kidnapped by sinister treasure hunters.,Two tiny agents vs. the world's wickedest woman in a dazzling animated adventure!,Released,,tt0076618,78,7500000,169015869,4.1419,6.789,2668,1977-06-22,False,False,/9jpDjrRyvv9Nw0piXOpHHQTfxw9.jpg,/dSlofjxxcTSLmnH6602WsSSELU5.jpg,57971,The Rescuers Collection,Wolfgang Reitherman,2026-04-20 18:18:06.436570
228161,Home,Home,en,"When Earth is taken over by the overly-confident Boov, an alien race in search of a new place to call home, all humans are promptly relocated, while all Boov get busy reorganizing the planet. But when one resourceful girl, Tip, manages to avoid capture, she finds herself the accidental accomplice of a banished Boov named Oh. The two fugitives realize there’s a lot more at stake than intergalactic relations as they embark on the road trip of a lifetime.",Earth just got a little stranger.,Released,http://www.meettheboov.com/,tt2224026,94,135000000,368871007,9.08,6.8,4194,2015-03-18,False,False,/usFenYnk6mr8C62dB1MoAfSWMGR.jpg,/gnkBzJVH2zicIopP2fHf4kRElne.jpg,,,Tim Johnson,2026-04-20 18:18:06.821558
9647,Scrooged,Scrooged,en,"Frank Cross is a wildly successful television executive whose cold ambition and curmudgeonly nature has driven away the love of his life. But after firing a staff member on Christmas Eve, Frank is visited by a series of ghosts who give him a chance to re-evaluate his actions and right the wrongs of his past.",The spirits will move you in odd and hysterical ways.,Released,,tt0096061,101,32000000,60300000,5.6247,6.784,1683,1988-11-22,False,False,/uO0znfB2ZzTXA1IS7jkrjNbpkYK.jpg,/6Cld2xtKYfWnWK3w3gfJRRA82vd.jpg,,,Richard Donner,2026-04-20 18:18:07.519233
2179,Tenacious D in The Pick of Destiny,Tenacious D in The Pick of Destiny,en,"In Venice Beach, naive Midwesterner JB bonds with local slacker KG and they form the rock band Tenacious D. Setting out to become the world's greatest band is no easy feat, so they set out to steal what could be the answer to their prayers... a magical guitar pick housed in a rock-and-roll museum some 300 miles away.",An epic quest. A magical guitar pick. A chance to put the D in Destiny.,Released,http://www.tenaciousdmovie.com/,tt0365830,93,22000000,13405595,6.7701,6.782,1757,2006-11-22,False,False,/7NmDIj5I1OFOZfYFnS3uWtM7WMO.jpg,/phWTf9WMNXeCO7W96QdX9Yp0n38.jpg,,,Liam Lynch,2026-04-20 18:18:08.070680
601796,Alienoid,외계+인 1부,ko,"Gurus in the late Goryeo dynasty try to obtain a fabled, holy sword, and humans in 2022 hunt down an alien prisoner that is locked in a human's body. The two parties cross paths when a time-traveling portal opens up.","For ages, aliens have locked up their prisoners in humans bodies.",Released,,tt20168564,142,24500000,12109608,5.9297,6.781,511,2022-07-20,False,False,/8QVDXDiOGHRcAD4oM6MXjE0osSj.jpg,/7ZP8HtgOIDaBs12krXgUIygqEsy.jpg,1000386,Alienoid Collection,Choi Dong-hoon,2026-04-20 18:18:08.589966
8871,How the Grinch Stole Christmas,How the Grinch Stole Christmas,en,The Grinch decides to rob Whoville of Christmas - but a dash of kindness from little Cindy Lou Who and her family may be enough to melt his heart...,You better watch out!,Released,,tt0170016,105,123000000,345800000,9.9435,6.778,8228,2000-11-17,False,False,/1WZbbPApEivA421gCOluuzMMKCk.jpg,/sy0vo1cmpKqwPRiMUiJ45jyLsX7.jpg,,,Ron Howard,2026-04-20 18:18:08.979140
424781,Sorry to Bother You,Sorry to Bother You,en,"In an alternate present-day version of Oakland, black telemarketer Cassius Green discovers a magical key to professional success – which propels him into a macabre universe.",Destiny is calling.,Released,http://sorrytobotheryou.movie,tt5688932,112,3200000,18200000,6.256,6.775,1735,2018-07-06,False,False,/peTl1V04E9ppvhgvNmSX0r2ALqO.jpg,/x832ykgj3fx0Q0MFKEno77XM47e.jpg,,,Boots Riley,2026-04-20 18:18:09.457223
9374,Death Becomes Her,Death Becomes Her,en,"Madeline is married to Ernest, who was once her arch-rival Helen's fiancé. After recovering from a mental breakdown, Helen vows to kill Madeline and steal back Ernest. Unfortunately for everyone, the introduction of a magic potion causes things to be a great deal more complicated than a mere murder plot.",In one small bottle... The fountain of youth. The secret of eternal life. The power of an ancient potion. Sometimes it works... sometimes it doesn't.,Released,,tt0104070,104,55000000,149000000,8.459,6.776,2941,1992-07-30,False,False,/kkWxyyyWFK5KNk9WVwQuGEC9H9H.jpg,/vDFhaKEMKPIUePtQH2nOwSHfgPy.jpg,,,Robert Zemeckis,2026-04-20 18:18:10.045552
9100,The Craft,The Craft,en,"A Catholic school newcomer falls in with a clique of teen witches who wield their powers against all who dare to cross them -- be they teachers, rivals or meddlesome parents.",Welcome to the witching hour.,Released,,tt0115963,101,15000000,24800000,8.6101,6.774,2031,1996-05-03,False,False,/8bW2RdRkloYtEPhbQZN4wcdmJP4.jpg,/yAaAsbossCADVFdiqm8qAhd2gL0.jpg,758369,The Craft Collection,Andrew Fleming,2026-04-20 18:18:10.668800
10096,13 Going on 30,13 Going on 30,en,"After total humiliation at her thirteenth birthday party, Jenna Rink wants to just hide until she's thirty. Thanks to some magic wishing dust, Jenna's prayer has been answered. With a knockout body, a fabulous wardrobe, an athlete boyfriend, a dream job, and superstar friends, this can't be a better life. But soon Jenna realizes that adult life isn’t as easy as she hoped for.","For some, 13 feels like it was just yesterday. For Jenna, it was.",Released,https://www.sonypictures.com/movies/13goingon30,tt0337563,98,37000000,96458118,8.8944,6.77,5500,2004-04-13,False,False,/iNZdSIfhSCMtRILDNyhLn8UKeSG.jpg,/gBwujuep3xyjkPVbcLfhZ9sOHLP.jpg,,,Gary Winick,2026-04-20 18:18:11.168331
10195,Thor,Thor,en,"Against his father Odin's will, The Mighty Thor - a powerful but arrogant warrior god - recklessly reignites an ancient war. Thor is cast down to Earth and forced to live among humans as punishment. Once here, Thor learns what it takes to be a true hero when the most dangerous villain of his world sends the darkest forces of Asgard to invade Earth.",Courage is immortal.,Released,https://www.marvel.com/movies/thor,tt0800369,115,150000000,449326618,14.1397,6.769,22230,2011-04-21,False,False,/prSfAi1xGrhLQNxVSUFh61xQ4Qy.jpg,/cDJ61O1STtbWNBwefuqVrRe3d7l.jpg,131296,Thor Collection,Kenneth Branagh,2026-04-20 18:18:11.691289
11253,Hellboy II: The Golden Army,Hellboy II: The Golden Army,en,"Hellboy, his pyrokinetic girlfriend, Liz, and aquatic empath, Abe Sapien, face their biggest battle when an underworld elven prince plans to reclaim Earth for his magical kindred. Tired of living in the shadow of humans, Prince Nuada tries to awaken an ancient force of killing machines, the all-powerful Golden Army, to clear the way for fantasy creatures to roam free. Only Hellboy can stop the dark prince and prevent humanity's annihilation.",Believe it or not... He's the good guy.,Released,,tt0411477,120,85000000,160388063,5.5623,6.768,5563,2008-07-11,False,False,/zO0Wdrxnhx3KoJEvychSmnY3urC.jpg,/gqQKxYVIaYv53Qoy72nQqQxdXYF.jpg,17235,Hellboy Collection,Guillermo del Toro,2026-04-20 18:18:12.577728
325189,Teen Beach 2,Teen Beach 2,en,"When characters from the movie musical “Wet Side Story” get stuck in the real world, teens Brady and Mack must find a way to return them home.",Same surf. New turf.,Released,,tt3764966,104,0,0,5.1876,6.763,600,2015-06-26,False,False,/5hm2P8pMoeJlETIaSP6OWR0Lu7c.jpg,/iASQPdNZs2tIMK3ShfBQaSWYrfx.jpg,408196,Teen Beach Collection,Jeffrey Hornaday,2026-04-20 18:18:13.128653
159824,Hotel Transylvania 2,Hotel Transylvania 2,en,"When the old-old-old-fashioned vampire Vlad arrives at the hotel for an impromptu family get-together, Hotel Transylvania is in for a collision of supernatural old-school and modern day cool.",They're back to raise a little terror.,Released,,tt2510894,89,80000000,473200000,10.0941,6.8,6093,2015-09-21,False,False,/3nFnrivNgipSKZ8LZJJbRSlAcTR.jpg,/kFPWoBFBkVi3YDG8MyOOTrwGxPF.jpg,185103,Hotel Transylvania Collection,Genndy Tartakovsky,2026-04-20 18:18:13.493238
6435,Practical Magic,Practical Magic,en,"Sally and Gillian Owens, born into a magical family, have mostly avoided witchcraft themselves. But when Gillian's vicious boyfriend, Jimmy Angelov, dies unexpectedly, the Owens sisters give themselves a crash course in hard magic. With policeman Gary Hallet growing suspicious, the girls struggle to resurrect Angelov -- and unwittingly inject his corpse with an evil spirit that threatens to end their family line.","For two sisters from a family of witches, falling in love is the trickiest spell of all.",Released,,tt0120791,104,75000000,46733235,8.9597,6.8,1682,1998-10-16,False,False,/AwmToSgf2IL3aHv0QRVsR5KvChv.jpg,/mGznDQ8opBuRd004ChVWhDqjAyW.jpg,1354706,Practical Magic Collection,Griffin Dunne,2026-04-20 18:18:14.093736
571891,Pokémon the Movie: Mewtwo Strikes Back - Evolution,ミュウツーの逆襲 EVOLUTION,ja,"After accepting an invitation from a mysterious trainer, Ash, Misty and Brock meet Mewtwo, an artificially created Pokémon who wants to do battle.",The legend returns...,Released,https://www.netflix.com/title/81223075,tt8856470,98,0,26654184,4.4404,6.8,562,2019-07-12,False,False,/rtlyO2oIMcCx2DbOM52XO2rAcgn.jpg,/xHyX5zQIdu13w708J4lYhmwEqNp.jpg,,,Motonori Sakakibara,2026-04-20 18:18:14.538836
44683,Tinker Bell and the Great Fairy Rescue,Tinker Bell and the Great Fairy Rescue,en,"During a summer stay on the mainland, Tinker Bell is accidentally discovered while investigating a little girl's fairy house. As the other fairies, led by the brash Vidia, launch a daring rescue in the middle of a fierce storm, Tink develops a special bond with the lonely, little girl.",,Released,http://disneydvd.disney.go.com/tinker-bell-and-the-great-fairy-rescue.html,tt1216515,76,0,0,6.8967,6.758,1001,2010-07-29,False,False,/cb7PrVIYbwIadQqWxgSU6CGHJjj.jpg,/5HRAb4wHgovzICuo3ZqgHXmqzeK.jpg,315595,Tinker Bell Collection,Bradley Raymond,2026-04-20 18:18:14.910861
635910,The Last Voyage of the Demeter,The Last Voyage of the Demeter,en,The crew of the merchant ship Demeter attempts to survive the ocean voyage from Carpathia to London as they are stalked each night by a merciless presence onboard the ship.,The legend of Dracula is born.,Released,https://www.demetermovie.com,tt1001520,119,45000000,21600000,7.2689,6.752,1905,2023-08-09,False,False,/nrtbv6Cew7qC7k9GsYSf5uSmuKh.jpg,/dKC5qWi6S8SKkSzrP6LxTk0cb98.jpg,,,André Øvredal,2026-04-20 18:18:15.303439
10510,Miracle on 34th Street,Miracle on 34th Street,en,"Six-year-old Susan Walker has doubts about childhood's most enduring miracle—Santa Claus. Her mother told her the secret about Santa a long time ago, but, after meeting a special department store Santa who's convinced he's the real thing, Susan is given the most precious gift of all—something to believe in.","If you really believe, anything can happen.",Released,,tt0110527,114,0,46264384,6.2914,6.751,1139,1994-11-18,False,False,/iUTPKkljdEjPlcPPYgbUz7APnHu.jpg,/oU0lGpUukjNOgZeuIqueNM3QiBE.jpg,,,Les Mayfield,2026-04-20 18:18:15.827332
4244,The Kid,The Kid,en,"Powerful businessman Russ Duritz is self-absorbed and immersed in his work. But by the magic of the moon, he meets Rusty, a chubby, charming 8-year-old version of himself who can't believe he could turn out so badly – with no life and no dog. With Rusty's help, Russ is able to reconcile the person he used to dream of being with the man he's actually become.",Nobody ever grows up quite like they imagined.,Released,https://movies.disney.com/the-kid,tt0219854,104,65000000,110317580,4.121,6.753,1105,2000-07-07,False,False,/kMRZhiF08nDiO5aRb81Np5a4d6p.jpg,/jEMYEoQw7jF0aoKRgaa1TbHojUT.jpg,,,Jon Turteltaub,2026-04-20 18:18:16.345249
15849,The Mummy,The Mummy,en,An ancient Egyptian priest named Imhotep is revived when a British archaeological expedition finds his mummy and one of the researchers accidentally reads an ancient life-giving spell. Imhotep escapes from the field site and searches for the reincarnation of the soul of his lover.,It comes to life!,Released,https://www.universalpicturesathome.com/movies/the-mummy-1932,tt0023245,73,196000,1408,4.6861,6.749,691,1932-12-22,False,False,/vSKpbZVvzqQcw6htiyEinbCY9vq.jpg,/7LIbyeZwoeMPPfSaYuQ6VxrCi4T.jpg,221544,The Mummy (Universal) Collection,Karl Freund,2026-04-20 18:18:16.801685
21481,Twitches,Twitches,en,"Twins separated at birth, Camryn and Alex meet by chance for the first time on their 21st birthday and discover they're witches with the power to save their homeland of Coventry from the evil that threatens it. But when Camryn leaves Alex to face the darkness alone, will Coventry be doomed? Or will the sisters multiply their magic by standing together?","This Halloween, broomsticks are so not happenin'.",Released,,tt0467421,86,20000000,0,6.3407,6.744,532,2005-10-14,False,False,/8ctDK5B0uR2gre2PxQSSkJZFmh.jpg,/biWonOe1GrPEMqvXhr7FbLox6xt.jpg,263106,Twitches Collection,Stuart Gillard,2026-04-20 18:18:17.160612
755566,Day Shift,Day Shift,en,An LA vampire hunter has a week to come up with the cash to pay for his kid's tuition and braces. Trying to make a living these days just might kill him.,Some jobs really go for the throat.,Released,https://www.netflix.com/title/81186049,tt13314558,113,100000000,0,8.2696,6.743,2173,2022-08-12,False,False,/tkl7n5r542S40hnYDI27lGNCACu.jpg,/yjZM4QrgA7PqX18Es6DxvJQH3ba.jpg,,,J.J. Perry,2026-04-20 18:18:17.516758
7985,Penelope,Penelope,en,"Forlorn heiress Penelope Wilhern is cursed, and the only way out is to fall in love with someone of suitable stock. But how can she find her soulmate when she's sequestered inside her family's estate with only her parents to keep her company? This untraditional fairy tale is about a girl who bucks convention to create her own happy ending.",A fairytale like no other.,Released,http://www.penelopethemovie.com/,tt0472160,104,15000000,21156270,6.6638,6.743,1464,2007-11-17,False,False,/stsGbgMhDo3VjLLsrbeiz0fuj8d.jpg,/kbD1di34NzIJAhorYxUob1PR7cR.jpg,,,Mark Palansky,2026-04-20 18:18:17.905859
36897,Pokémon: Mewtwo Returns,ポケットモンスター ミュウツー! 我ハココニ在リ MEWTWO SAGA,ja,"The Team Rocket leader, Giovanni, has found Mewtwo in a remote area of the Johto region. As Giovanni tries to re-capture Mewtwo, Ash and his friends are kidnapped by Domino, a new Team Rocket member, while trying to rescue Pikachu from Jessie and James. The Clone Pokemon are also captured and are then used as bait for Mewtwo. The situation then becomes a battle between the wills of Mewtwo and Giovanni; and Mewtwo also tries to discover if it and the clones have a purpose in life, even though they are products of science.",An all-new Johto movie adventure!,Released,,tt0304564,63,0,0,2.6543,6.7,425,2001-08-17,False,False,/zIYljUBF2rXzB0yYZVEPY1l8zHp.jpg,/pJszL2mPl084IDSzLDPH8NqIq0r.jpg,,,Masamitsu Hidaka,2026-04-20 18:18:18.327665
12599,Pokémon the Movie 2000,劇場版ポケットモンスター 幻のポケモン ルギア爆誕,ja,"When Lawrence III's scheme to capture the Legendary Pokémon Lugia upsets the balance of nature, it is up to Ash Ketchum and his friends to save the world.",One person can make all the difference.,Released,https://www.warnerbros.com/movies/pokemon-movie-2000,tt0210234,84,30000000,133949270,4.7352,6.7,929,1999-07-17,False,False,/6u65C8aG4krAVyHsTjAMF7ucTDH.jpg,/bS93S5uEVZng4qmDhmDMXTSEuay.jpg,34055,Pokémon Collection,Kunihiko Yuyama,2026-04-20 18:18:18.690407
1870,Fantomas Unleashed,Fantômas se déchaîne,fr,"In the second episode of the trilogy Fantômas kidnaps distinguished scientist professor Marchand with the aim to develop a super weapon that will enable him to menace the world. Fantômas is also planning to abduct a second scientist, professor Lefebvre.",,Released,,tt0059168,105,0,0,1.6957,6.734,566,1965-12-08,False,False,/wtMGO5JyORkd1CF7e6pyn47dITm.jpg,/2m4oXN0EitDYsHpVoPOXNhChk7s.jpg,103001,Fantomas Collection,André Hunebelle,2026-04-20 18:18:19.144225
253980,Marvel One-Shot: All Hail the King,Marvel One-Shot: All Hail the King,en,A documentary filmmaker interviews the now-famous Trevor Slattery from behind bars.,The Toast of Croydon is back.,Released,,tt3438640,14,0,0,4.6151,6.731,604,2014-02-04,False,False,/y0QYZPWgeGKOvyrzi6Oz3aJPxJa.jpg,/yoigAFjhEhJM6O6hQT9TiKH6EL7.jpg,,,Drew Pearce,2026-04-20 18:18:19.545516
10837,DuckTales: The Movie - Treasure of the Lost Lamp,DuckTales: The Movie - Treasure of the Lost Lamp,en,"With his nephews and niece, everyone's favorite rich uncle, Scrooge McDuck, treks from his mansion home in Duckburg in search of the long-lost loot of the thief Collie Baba. But finding the goods isn't quite what it's ""quacked"" up to be! Their thrilling adventure leads to comical chaos, magical mayhem, and a lesson about what is far more valuable than money, gold and jewels.",,Released,,tt0099472,74,20000000,18115724,6.0334,6.727,919,1990-08-03,False,False,/tXya1Z9SC51kNOHsFxRqL1GIBua.jpg,/rpFJFmZplfOp2JzpmsWzmX72hJK.jpg,,,Bob Hathcock,2026-04-20 18:18:19.885630
