movie_id,title,original_title,original_language,overview,tagline,status,homepage,imdb_id,runtime,budget,revenue,popularity,vote_average,vote_count,release_date,adult,video,poster_path,backdrop_path,collection_id,collection_name,director,last_updated
13600,City of Ember,City of Ember,en,"For generations, the people of the City of Ember have flourished in an amazing world of glittering lights. But Ember's once powerful generator is failing and the great lamps that illuminate the city are starting to flicker. Now, two teenagers, in a race against time, must search Ember for clues that will unlock the ancient mystery of the city's existence, before the the lights go out forever.",Escape is the only option,Released,http://www.cityofember.com/,tt0970411,95,55000000,17869048,6.8111,6.345,1874,2008-10-07,False,False,/xHYxFNsl8KuT4tHai8d1Y5gJI0F.jpg,/n8KxhAnfoAFoOrYLQcHi7nhp1zB.jpg,,,Gil Kenan,2026-04-20 18:20:01.707874
521034,The Secret Garden,The Secret Garden,en,"Mary Lennox is born in India to wealthy British parents who never wanted her. When her parents suddenly die, she is sent back to England to live with her uncle. She meets her sickly cousin, and the two children find a wondrous secret garden lost in the grounds of Misselthwaite Manor.",Unlock your imagination,Released,http://stxfilms.com/thesecretgarden,tt2702920,100,0,8721243,5.2991,6.3,607,2020-07-08,False,False,/5MSDwUcqnGodFTvtlLiLKK0XKS.jpg,/usIfpM7Lr3r9fWTvMGZ8HoD1f8f.jpg,,,Marc Munden,2026-04-20 18:20:02.157875
11232,Kate & Leopold,Kate & Leopold,en,"When her scientist ex-boyfriend discovers a portal to travel through time -- and brings back a 19th-century nobleman named Leopold to prove it -- a skeptical Kate reluctantly takes responsibility for showing Leopold the 21st century. The more time Kate spends with Leopold, the harder she falls for him. But if he doesn't return to his own time, his absence will forever alter history.","If they lived in the same century, they'd be perfect for each other.",Released,,tt0035423,118,48000000,76019048,5.3174,6.3,1468,2001-12-25,False,False,/fbWYmlGvQXmmZEr4bMeJFjWfFXZ.jpg,/2nKFPGQDMMMW13zyLTmO2M7rMI3.jpg,,,James Mangold,2026-04-20 18:20:02.769495
8839,Casper,Casper,en,"Casper is a kind young ghost who peacefully haunts a mansion in Maine. When specialist James Harvey arrives to communicate with Casper and his fellow spirits, he brings along his teenage daughter, Kat. Casper quickly falls in love with Kat, but their budding relationship is complicated not only by his transparent state, but also by his troublemaking apparition uncles and their mischievous antics.",Seeing is believing.,Released,,tt0112642,100,50000000,287928194,9.1693,6.336,4892,1995-05-26,False,False,/2ah8fNJFZVU3vcXhU5xfAYi2eym.jpg,/sQPckU0TfSeYIlUneHfIXwzQC2f.jpg,8819,Casper Collection,Brad Silberling,2026-04-20 18:20:03.471970
531219,Roald Dahl's The Witches,Roald Dahl's The Witches,en,"In late 1967, a young orphaned boy goes to live with his loving grandma in the rural Alabama town of Demopolis. As the boy and his grandmother encounter some deceptively glamorous but thoroughly diabolical witches, she wisely whisks him away to a seaside resort. Regrettably, they arrive at precisely the same time that the world's Grand High Witch has gathered.",WITCHES ARE REAL!,Released,https://www.warnerbros.com/movies/roald-dahls-witches,tt0805647,104,0,29303571,11.0914,6.336,2968,2020-10-26,False,False,/ht6EfsM5hrsUPSR4ReJQFDVU71F.jpg,/4lWr2j3ZSEe8qlt3W3ma8TiiMQB.jpg,,,Robert Zemeckis,2026-04-20 18:20:04.179306
52520,Underworld: Awakening,Underworld: Awakening,en,"Having escaped years of imprisonment, vampire warrioress Selene finds herself in a changed world where humans have discovered the existence of both Vampire and Lycan clans and are conducting an all-out war to eradicate both immortal species. Now Selene must battle the humans and a frightening new breed of super Lycans to ensure the death dealers' survival.",Vengeance Returns,Released,https://www.sonypictures.com/movies/underworldawakening,tt1496025,88,70000000,160112671,7.4633,6.333,4326,2012-01-19,False,False,/jN0uuc8U6M3sTg9zEaliJV60Stf.jpg,/wJJJS5ey53DqJ3cTuu7GFJsRsWu.jpg,2326,Underworld Collection,Björn Stein,2026-04-20 18:20:05.077325
8965,Atlantis: Milo's Return,Atlantis: Milo's Return,en,Milo and Kida reunite with their friends to investigate strange occurances around the world that seem to have links to the secrets of Atlantis.,The all-new adventures,Released,http://disneydvd.disney.go.com/atlantis-milos-return.html,tt0344864,80,0,0,5.6131,6.334,3892,2003-02-25,False,False,/hyAbWGld5WLdrmUB9OHyewcJQGL.jpg,/GDTwA5FBvVUOjCGKoNDMflbs3Z.jpg,100965,Atlantis Collection,Victor Cook,2026-04-20 18:20:05.676643
606234,Archive,Archive,en,"2038: George Almore is working on a true human-equivalent AI, and his latest prototype is almost ready. This sensitive phase is also the riskiest as he has a goal that must be hidden at all costs—being reunited with his dead wife.",Death is not the end,Released,,tt6882604,109,0,243279,6.4961,6.329,785,2020-08-13,False,False,/hmz9ySdCqW9FiHpM9JdSCkjQzFA.jpg,/u9YEh2xVAPVTKoaMNlB5tH6pXkm.jpg,,,Gavin Rothery,2026-04-20 18:20:06.132986
593910,Cinderella,Cinderella,en,"Cinderella, an orphaned girl with an evil stepmother, has big dreams and with the help of her Fabulous Godmother, she perseveres to make them come true.",One shoe to rule them all.,Released,https://www.amazon.com/dp/B097YYZ87F,tt10155932,112,0,42494,6.8555,6.3,1464,2021-09-03,False,False,/clDFqATL4zcE7LzUwkrVj3zHvk7.jpg,/7ZiMrbitgbyio4eOzFKRruPKu5G.jpg,,,Kay Cannon,2026-04-20 18:20:06.814588
40205,16 Wishes,16 Wishes,en,"The story about Abby Jensen, a girl who's been eager to reach her 16th birthday and has kept a secret wish list since she was a little girl. When the Big Day actually arrives, utter disaster strikes, leaving Abby to think her birthday is ruined. But when a mysterious box of magical birthday candles arrives to turn things around, Abby's 16 Wishes start to come true. Her day gets better and better...until she makes one wish that threatens to change everything.","Everyone's sweet 16 is special, Abby's is magical.",Released,,tt1646876,90,0,0,5.6998,6.318,1359,2010-10-02,False,False,/tO8TZvH83uHtrLnec6f684xfzOB.jpg,/53gLUhvVffVXSXOPAuXPeHkqEe9.jpg,,,Peter DeLuise,2026-04-20 18:20:07.315838
214756,Ted 2,Ted 2,en,"Newlywed couple Ted and Tami-Lynn want to have a baby, but in order to qualify to be a parent, Ted will have to prove he's a person in a court of law.",Thunder buddies for life.,Released,https://www.uphe.com/movies/ted-2,tt2637276,115,68000000,215863606,28.6542,6.316,7931,2015-06-25,False,False,/38C91I7Xft0gyY7BITm8i4yvuRb.jpg,/xtHonIIIQXverDQM08TMQXjn9Fe.jpg,266672,Ted Collection,Seth MacFarlane,2026-04-20 18:20:07.916056
203739,Vampire Academy,Vampire Academy,en,"Rose, a rebellious half-vampire/half-human guardian-in-training and her best friend, Lissa -- a mortal, royal vampire Princess - have been on the run when they are captured and returned to St. Vladamirs Academy, the very place where they believe their lives may be in most jeopardy. Rose will sacrifice everything to protect Lissa from those who intend to exploit her from within the Academy walls and the Strigoi (immortal, evil vampires) who hunt her kind from outside its sanctuary.",They suck at school.,Released,,tt1686821,104,30000000,15391979,5.8617,6.315,1809,2014-02-07,False,False,/cJZpKgiFfjDZ6L5aOJvbmDhsGqY.jpg,/ttb2OaMIWpuq8Y0bTIOSXlOvyEk.jpg,,,Mark Waters,2026-04-20 18:20:08.635257
9945,Vampires,Vampires,en,The church enlists a team of vampire-hunters to hunt down and destroy a group of vampires searching for an ancient relic that will allow them to exist in sunlight.,Prepare for the dawn.,Released,http://www.theofficialjohncarpenter.com/vampires,tt0120877,108,20000000,20308772,6.6941,6.315,1340,1998-10-30,False,False,/4JhaFBPwyC5IM1rKaRR07Gzutse.jpg,/uzlGbsQkpK6C3ZiqRqKw9CwK0Do.jpg,348843,Vampires Collection,John Carpenter,2026-04-20 18:20:09.141481
16996,17 Again,17 Again,en,"On the brink of a midlife crisis, 30-something Mike O'Donnell wishes he could have a ""do-over."" And that's exactly what he gets when he wakes up one morning to find he's 17 years old again. With his adult mind stuck inside the body of a teenager, Mike actually has the chance to reverse some decisions he wishes he'd never made. But maybe they weren't so bad after all.",Who says you're only young once?,Released,http://www.17againmovie.com/,tt0974661,102,20000000,136300000,7.8805,6.314,5392,2009-03-11,False,False,/yEcfFXEWpuXcfsR9nKESVCFneqV.jpg,/mjSiMvkpDk11AQrMxQNf4rDWKx2.jpg,,,Burr Steers,2026-04-20 18:20:09.620934
35019,Nanny McPhee and the Big Bang,Nanny McPhee and the Big Bang,en,"Nanny McPhee appears at the door of a harried young mother who is trying to run the family farm while her husband is away at war. But once she’s arrived, Nanny discovers that the children are fighting a war of their own against two spoiled city cousins who have just moved in. Relying on everything from a flying motorcycle and a statue that comes to life to a tree-climbing piglet and a baby elephant, Nanny uses her magic to teach her mischievous charges five new lessons.","The magic's back, warts and all.",Released,http://www.nannymcphee.co.uk/,tt1415283,109,35000000,93251121,8.996,6.313,1937,2010-03-26,False,False,/9cgHfgBXVZmVR63AhwJ82R1kAFS.jpg,/cQW6UoDxwwfqIMTVfxdxHk4JLGP.jpg,35792,Nanny McPhee Collection,Susanna White,2026-04-20 18:20:10.159448
9822,Mighty Joe Young,Mighty Joe Young,en,"As a child living in Africa, Jill Young saw her mother killed while protecting wild gorillas from poachers led by Andrei Strasser. Now an adult, Jill cares for an orphaned gorilla named Joe -- who, due to a genetic anomaly, is 15 feet tall. When Gregg O'Hara arrives from California and sees the animal, he convinces Jill that Joe would be safest at his wildlife refuge. But Strasser follows them to the U.S., intent on capturing Joe for himself.",Survival is an instinct.,Released,https://movies.disney.com/mighty-joe-young,tt0120751,114,90000000,0,6.471,6.312,864,1998-12-25,False,False,/93oAWBl6UIEmeknmRKbUkVq4cKl.jpg,/dkNjhkEk2tw7hoxx7Ik1YQsdenZ.jpg,,,Ron Underwood,2026-04-20 18:20:10.575542
976720,Vesper,Vesper,en,"After the collapse of Earth's ecosystem, Vesper, a 13-year-old girl struggling to survive with her paralyzed Father, meets a mysterious Woman with a secret that forces Vesper to use her wits, strength and bio-hacking abilities to fight for the possibility of a future.",One seed can change everything,Released,,tt20225374,112,0,889529,6.2397,6.3,688,2022-08-17,False,False,/etvK8ni1adjXU8obDpdUxTTQT6n.jpg,/uczbEzBD4jJ7EYxySarXeh2liF5.jpg,,,Kristina Buožytė,2026-04-20 18:20:11.009484
638965,Mandibles,Mandibules,fr,"When two simple-minded best friends find a giant fly trapped in the trunk of a stolen car, they decide to train it in hopes of striking it rich.",,Released,,tt10375106,77,4900000,2044087,1.6811,6.309,605,2021-05-19,False,False,/pdizbiLiOiV8ysYknz79VMitsfU.jpg,/1Rl22zqQw5YGVmmAPpMyQDUD723.jpg,,,Quentin Dupieux,2026-04-20 18:20:11.560352
38117,Beastly,Beastly,en,"A modern-day take on the ""Beauty and the Beast"" tale where a New York teen is transformed into a hideous monster in order to find true love.",Love is never ugly.,Released,http://www.sonypictures.com/movies/beastly,tt1152398,86,17000000,43200000,6.6313,6.307,2856,2011-01-21,False,False,/uSAXWZsSD0pE4HYVUiDgusnEyyl.jpg,/hU4OdICqRXj3JFnSJsrR0SJejZy.jpg,,,Daniel Barnz,2026-04-20 18:20:12.055102
409297,A Dark Song,A Dark Song,en,A determined young woman and a damaged occultist risk their lives and souls to perform a dangerous ritual that will grant them what they want.,Not everything can be forgiven.,Released,,tt4805316,100,0,0,7.0892,6.305,540,2016-07-08,False,False,/fguce8M1bZnWjVkRWCFh9P3kt6A.jpg,/sac5saRWC8zV8GFHL4D45TuUr3s.jpg,,,Liam Gavin,2026-04-20 18:20:12.438851
810,Shrek the Third,Shrek the Third,en,"The King of Far Far Away has died and Shrek and Fiona are to become King & Queen. However, Shrek wants to return to his cozy swamp and live in peace and quiet, so when he finds out there is another heir to the throne, they set off to bring him back to rule the kingdom.",He's in for the royal treatment.,Released,http://www.shrekthethird.com/flash/index.html,tt0413267,93,160000000,813367380,11.5553,6.305,9715,2007-05-17,False,False,/n4SexGGQzI26E269tfpa80MZaGV.jpg,/wvXxKpFGXvQJRB0nvvfURhRD3C0.jpg,2150,Shrek Collection,Chris Miller,2026-04-20 18:20:12.797344
9339,Click,Click,en,"A married workaholic, Michael Newman doesn't have time for his wife and children, not if he's to impress his ungrateful boss and earn a well-deserved promotion. So when he meets Morty, a loopy sales clerk, he gets the answer to his prayers: a magical remote that allows him to bypass life's little distractions with increasingly hysterical results.",What if you had a universal remote...that controlled your universe?,Released,https://www.sonypictures.com/movies/click,tt0389860,107,82500000,240685326,9.4869,6.302,7508,2006-06-23,False,False,/oL0k5JA53PyoHSZqKb3cNkhwBCE.jpg,/h30q7IXCmlgR1wKLnp9LttH6BCG.jpg,,,Frank Coraci,2026-04-20 18:20:13.213337
149509,Horns,Horns,en,"In the aftermath of his girlfriend's mysterious death, a young man awakens to strange horns sprouting from his temples.",He will bring out the Devil in you.,Released,,tt1528071,120,0,3900000,6.7228,6.296,2419,2013-09-06,False,False,/tjTy6W05mPXXw87IqpjeGNhIcM4.jpg,/mORSowyx92dlvx9zYOKXZx0NpAW.jpg,,,Alexandre Aja,2026-04-20 18:20:13.967061
9543,Prince of Persia: The Sands of Time,Prince of Persia: The Sands of Time,en,"A rogue prince reluctantly joins forces with a mysterious princess and together, they race against dark forces to safeguard an ancient dagger capable of releasing the Sands of Time – gift from the gods that can reverse time and allow its possessor to rule the world.",Defy the Future,Released,https://movies.disney.com/prince-of-persia-the-sands-of-time,tt0473075,116,200000000,336365676,7.9474,6.295,7119,2010-05-19,False,False,/siNGMLdOUNYLEGtlsnmQcpO2XZX.jpg,/iP0capCU4w5nxCDl398CH7yR1r9.jpg,,,Mike Newell,2026-04-20 18:20:14.427470
11114,Pete's Dragon,Pete's Dragon,en,"Pete, a young orphan, runs away to a Maine fishing town with his best friend a lovable, sometimes invisible dragon named Elliott! When they are taken in by a kind lighthouse keeper, Nora, and her father, Elliott's prank playing lands them in big trouble. Then, when crooked salesmen try to capture Elliott for their own gain, Pete must attempt a daring rescue.",Brazzle Dazzle Brilliance!,Released,,tt0076538,128,10000000,0,4.739,6.3,714,1977-11-03,False,False,/noShGNQKAgMqNanJL5EiZlf6LCp.jpg,/hoItQR25BE6qWLInEq1iRPgBDDZ.jpg,,,Don Chaffey,2026-04-20 18:20:14.988635
102780,Byzantium,Byzantium,en,"Residents of a coastal town learn, with deadly consequences, the secret shared by the two mysterious women who have sought refuge at a local boarding house, the Byzantium.",Irresistible. Immoral. Immortal.,Released,,tt1531901,118,10000000,89237,5.5734,6.294,952,2013-04-11,False,False,/kFkfRnXz6Rk9tAKgUznJH1FURQ6.jpg,/65Hu40ajfe7PTB5W0pYBSWTfwTq.jpg,,,Neil Jordan,2026-04-20 18:20:15.347835
532639,Pinocchio,Pinocchio,en,A wooden puppet embarks on a thrilling adventure to become a real boy.,The beloved classic comes to life.,Released,https://www.disneyplus.com/movies/pinocchio/5fzcpc295rQn,tt4593060,105,0,0,8.1454,6.291,1716,2022-09-07,False,False,/zaZhjKrJeWczQ3AotKoQObppEbH.jpg,/nnUQqlVZeEGuCRx8SaoCU4XVHJN.jpg,,,Robert Zemeckis,2026-04-20 18:20:16.093903
2309,Inkheart,Inkheart,en,"The adventures of a father and his young daughter, in their search for a long lost book that will help reunite a missing, close relative.",Every story ever written is just waiting to become real.,Released,http://www.inkheartmovie.com/,tt0494238,106,60000000,62803180,7.133,6.289,2238,2008-12-11,False,False,/eXFK5aBDzUPSynAhSKMJy7xLxqE.jpg,/dA1IWByfIvTktERGU4bzQqD3Xu8.jpg,,,Iain Softley,2026-04-20 18:20:16.734575
455476,Knights of the Zodiac,Knights of the Zodiac,en,"When a headstrong street orphan, Seiya, in search of his abducted sister unwittingly taps into hidden powers, he discovers he might be the only person alive who can protect a reincarnated goddess, sent to watch over humanity. Can he let his past go and embrace his destiny to become a Knight of the Zodiac?",Go beyond your destiny.,Released,https://kotzmovie.com,tt6528290,112,60000000,7000000,7.0432,6.289,1277,2023-04-27,False,False,/qW4crfED8mpNDadSmMdi7ZDzhXF.jpg,/fLEsa5SKTFgrdUGMHbsWomniak6.jpg,,,Tomek Bagiński,2026-04-20 18:20:17.306533
76122,Marvel One-Shot: The Consultant,Marvel One-Shot: The Consultant,en,"Agent Coulson informs Agent Sitwell that the World Security Council wishes Emil Blonsky to be released from prison to join the Avengers Initiative. As Nick Fury doesn't want to release Blonsky, the two agents decide to send a patsy to sabotage the meeting...",,Released,,tt2011118,4,500000,0,3.6849,6.287,610,2011-09-13,False,False,/xqNLXUUvBnfVk6m3QFGGU0Grgs7.jpg,/r1Q3jyOpfbF3VDU52w8RzkTPbfe.jpg,,,Leythum,2026-04-20 18:20:17.691519
16441,The Beastmaster,The Beastmaster,en,"Dar, is the son of a king, who's hunted by a priest after his birth and grows up in another family. When he becomes a grown man, his new father is murdered by savages and he discovers that he's the ability to communicate with the animals, which leads him on his quest for revenge against his father's killers.","Born with the courage of an eagle, the strength of a black tiger, and the power of a god.",Released,,tt0083630,118,8000000,14056528,4.6567,6.287,447,1982-08-16,False,False,/ytaKNYpHdQnClTbWL2m19Xv6PXZ.jpg,/zHTnieWaWlObW2wLQO3ePkwHlom.jpg,106000,The Beastmaster Collection,Don Coscarelli,2026-04-20 18:20:18.039422
267935,The BFG,The BFG,en,"An orphan little girl befriends a benevolent giant who takes her to Giant Country, where they attempt to stop the man-eating giants that are invading the human world.",The world is more giant than you can imagine.,Released,http://movies.disney.com/the-bfg,tt3691740,117,140000000,195243411,8.2603,6.286,3605,2016-06-01,False,False,/w17Mc2x2olB5CtewznUFxgpvne0.jpg,/tOTtJelsPKX0bvSdvDVL2ou3cGS.jpg,,,Steven Spielberg,2026-04-20 18:20:18.622754
19901,Daybreakers,Daybreakers,en,"In the year 2019, a plague has transformed almost every human into a vampire. Faced with a dwindling blood supply, the fractured dominant race plots their survival; meanwhile, a researcher works with a covert band of vampires on a way to save humankind.","In 2019, the most precious natural resource... is us.",Released,http://www.daybreakersmovie.com/,tt0433362,98,20000000,51417188,6.1134,6.282,2146,2010-01-06,False,False,/xFZH2l9UOyIclk2ZFWNHQ38B2RP.jpg,/gsi9F4tHPWJbVQSYaO1YDAAbdhU.jpg,,,Michael Spierig,2026-04-20 18:20:19.088132
10730,King Kong,King Kong,en,An oil company expedition disturbs the peace of a giant ape and brings him back to New York to exploit him.,The most exciting original motion picture event of all time.,Released,,tt0074751,134,23000000,90614445,6.5022,6.3,912,1976-09-08,False,False,/paYKhEwUaxKA05vmOfU7FlleTln.jpg,/iRSRs1RRIXzYt7geifmSeg7qCdr.jpg,135498,King Kong (1976) Collection,John Guillermin,2026-04-20 18:20:19.831061
14207,The Librarian: Quest for the Spear,The Librarian: Quest for the Spear,en,"When a magical artifact is lifted from his library, a meek librarian sets out to ensure its safe return.",,Released,http://www.tntdrama.com/movies/the-librarian-quest-for-the-spear.html,tt0412915,106,0,0,5.7779,6.281,697,2004-07-12,False,False,/wRwbSr0imj632D0qxaHQig4WYf3.jpg,/crsADrmQFBtTFfiZaCXjpBOyzMP.jpg,85890,The Librarian Collection,Peter Winther,2026-04-20 18:20:20.255023
8966,Twilight,Twilight,en,"When Bella Swan moves to a small town in the Pacific Northwest, she falls in love with Edward Cullen, a mysterious classmate who reveals himself to be a 108-year-old vampire. Despite Edward's repeated cautions, Bella can't stay away from him, a fatal move that endangers her own life.","When you can live forever, what do you live for?",Released,,tt1099212,122,37000000,393616788,22.6962,6.279,14324,2008-11-20,False,False,/3Gkb6jm6962ADUPaCBqzz9CTbn9.jpg,/weAYfu6FfrNxEDJ3xH1XpgQcqUv.jpg,33514,The Twilight Collection,Catherine Hardwicke,2026-04-20 18:20:20.627335
339967,Colossal,Colossal,en,A woman discovers that severe catastrophic events are somehow connected to the mental breakdown from which she's suffering.,There's a monster in all of us,Released,http://sheiscolossal.com,tt4680182,109,15000000,3029287,5.9795,6.275,2254,2017-04-06,False,False,/4VOyofBd1pexblxtDZYtYIk7NI4.jpg,/jfnTuPMeksH5tnh9U4y6kRhz18s.jpg,,,Nacho Vigalondo,2026-04-20 18:20:21.184500
14208,The Librarian: Return to King Solomon's Mines,The Librarian: Return to King Solomon's Mines,en,"After retrieving the Crystal Skull in Utah, Flynn Carsen receives a map in the mail with the secret location of King Solomon's Mines. When the scroll is stolen, Judson explains the power of the Key of Solomon's book and assigns Flynn to retrieve the map. The map is useless without the legend piece to decipher it, which is located in Volubilis near the Roman ruins in Morocco. Flynn heads to Casablanca to the ruins where he is chased by a group of mercenaries leaded by General Samir. They too want to find the location of King Solomon's mines. Flynn teams-up with Professor Emily Davenport working in the dig and they escape from General Samir and his men. While traveling to Gedi, they save the local Jomo from death and the trio faces a dangerous journey through the wild Africa.",,Released,,tt0455596,92,0,0,5.0564,6.275,619,2006-09-09,False,False,/4UxUdJUCLwirPdYzAsYg8ayKhGN.jpg,/bQWaivEhhL37cCsnnhni9R33KGy.jpg,85890,The Librarian Collection,Jonathan Frakes,2026-04-20 18:20:21.665267
1013860,R.I.P.D. 2: Rise of the Damned,R.I.P.D. 2: Rise of the Damned,en,"When Sheriff Roy Pulsipher finds himself in the afterlife, he joins a special police force and returns to Earth to save humanity from the undead.",Meet the new law of the Afterlife.,Released,,tt21094994,102,0,0,3.8868,6.274,657,2022-11-15,False,False,/g4yJTzMtOBUTAR2Qnmj8TYIcFVq.jpg,/kmzppWh7ljL6K9fXW72bPN3gKwu.jpg,1041695,R.I.P.D. Collection,Paul Leyden,2026-04-20 18:20:22.161173
447277,The Little Mermaid,The Little Mermaid,en,"The youngest of King Triton’s daughters, and the most defiant, Ariel longs to find out more about the world beyond the sea, and while visiting the surface, falls for the dashing Prince Eric. With mermaids forbidden to interact with humans, Ariel makes a deal with the evil sea witch, Ursula, which gives her a chance to experience life on land, but ultimately places her life – and her father’s crown – in jeopardy.","Watch and you'll see, some day I'll be, part of your world!",Released,https://movies.disney.com/the-little-mermaid-2023,tt5971474,135,297000000,569626289,17.395,6.274,3283,2023-05-18,False,False,/ym1dxyOk4jFcSl4Q2zmRrA5BEEN.jpg,/lAs4Y5a8Pi86xDwuv8cx2prOVI2.jpg,,,Rob Marshall,2026-04-20 18:20:22.511873
303542,The Invisible Boy,Il ragazzo invisibile,it,"Michele is thirteen year old, shy, unpopular at school, and in love with Stella. After wearing a costume for a Halloween party, he finds out that he's invisible.",The power to disappear is only the beginning.,Released,,tt3078296,100,8000000,5216102,2.2419,6.3,978,2014-12-18,False,False,/rmuU1ExeIZ6tKlr0690cSs7WY59.jpg,/3Nf45IBLyZVKQvHAQfPrKXVdCMK.jpg,537279,The Invisible Boy Collection,Gabriele Salvatores,2026-04-20 18:20:23.060725
451500,Christmas & Co.,Santa & Cie,fr,"Christmas is on its way and with it disaster. The 92,000 responsible for manufacturing children's toys all become sick at the same time! It's a tough moment for Santa, better known as Father Christmas. He's left no choice: he must make an emergency trip to Earth with his reindeer to search for a remedy. When he arrives, he must find some allies to save the magic of Christmas.",Hold on for deer life!,Released,,tt7018010,100,0,0,2.7158,6.27,669,2017-12-06,False,False,/sRsrP5iowmCGV2IvVWMga1EmHZA.jpg,/uc369Ws3HHY4NXCgs2hwb5pjrGN.jpg,,,Alain Chabat,2026-04-20 18:20:23.600305
58244,Upside Down,Upside Down,en,"In an alternate universe where twinned worlds have opposite gravities, a young man battles interplanetary prejudice and the laws of physics in his quest to reunite with the long-lost girl of his dreams in this visually stunning romantic adventure that poses the question: what if love was stronger than gravity?",Two worlds. One future.,Released,,tt1374992,104,60000000,22187813,5.8556,6.272,2604,2012-09-27,False,False,/wImo0dC72HRoI5QO85dGavmxW6q.jpg,/sKWh9hF0ekVhHHyGuJwdA3fnMGZ.jpg,,,Juan Diego Solanas,2026-04-20 18:20:24.063598
24452,The Little Shop of Horrors,The Little Shop of Horrors,en,"Seymour works in a skid row florist shop and is in love with his beautiful co-worker, Audrey. He creates a new plant that not only talks but cannot survive without human flesh and blood.",The funniest picture this year!,Released,,tt0054033,72,31000,25066,4.0819,6.3,456,1960-05-04,False,False,/s9MrumN9oCfv1rFoEvMLwucWD7V.jpg,/sGz7JApiDtClRFxffIw3WgRK8y2.jpg,,,Roger Corman,2026-04-20 18:20:24.676327
9598,Babe,Babe,en,"Babe is a little pig who doesn't quite know his place in the world. With a bunch of odd friends, like Ferdinand the duck who thinks he is a rooster and Fly the dog he calls mum, Babe realises that he has the makings to become the greatest sheep pig of all time, and Farmer Hoggett knows it. With the help of the sheep dogs, Babe learns that a pig can be anything that he wants to be.",A little pig goes a long way.,Released,,tt0112431,92,30000000,254100000,7.6504,6.3,3093,1995-07-18,False,False,/zKuQMtnbVTz9DsOnOJmlW71v4qH.jpg,/agkZziO4ZPAsVfKUrJD68lys08P.jpg,9435,Babe Collection,Chris Noonan,2026-04-20 18:20:25.007548
