movie_id,title,original_title,original_language,overview,tagline,status,homepage,imdb_id,runtime,budget,revenue,popularity,vote_average,vote_count,release_date,adult,video,poster_path,backdrop_path,collection_id,collection_name,director,last_updated
912598,Bubble,バブル,ja,"In an abandoned Tokyo overrun by bubbles and gravitational abnormalities, one gifted young man has a fateful meeting with a mysterious girl.",Is she a calamity or a blessing?,Released,https://www.netflix.com/title/81345945,tt16360006,101,0,0,3.6179,7.3,474,2022-02-14,False,False,/wjgwIZyEgtgy9nIdz6C5uJNel2X.jpg,/a8Q2g0g7XzAF6gcB8qgn37ccb9Y.jpg,,,Tetsuro Araki,2026-04-20 18:16:13.506773
1433,The Devil's Backbone,El espinazo del diablo,es,"Spain, 1939. In the last days of the Spanish Civil War, the young Carlos arrives at the Santa Lucía orphanage, where he will make friends and enemies as he follows the quiet footsteps of a mysterious presence eager for revenge.",What is a ghost?,Released,,tt0256009,108,4500000,6582065,3.6503,7.3,1346,2001-04-20,False,False,/iP1z1aJzPnkP8FHg77TS7ukqoEZ.jpg,/iUFylO8khUHGiSJanUZQfzZYyXI.jpg,,,Guillermo del Toro,2026-04-20 18:16:14.071345
842924,The Life of Chuck,The Life of Chuck,en,"In this extraordinary story of an ordinary man, Charles 'Chuck' Krantz experiences the wonder of love, the heartbreak of loss, and the multitudes contained in all of us.",Every life is a universe all its own.,Released,https://www.neonrated.com/film/the-life-of-chuck,tt12908150,111,25000000,19700844,9.5919,7.286,1008,2025-06-05,False,False,/oumprkO9bThExP8NwxBIBnvBu2v.jpg,/1SgD8XMa6dDSBKbPU4TDe2cmfGK.jpg,,,Mike Flanagan,2026-04-20 18:16:14.448032
416494,Status Update,Status Update,en,"After being uprooted by his parents' separation and unable to fit into his new hometown, a teenager stumbles upon a magical app that causes his social media updates to come true.",Imagine if every time you updated your status your dreams came true,Released,http://statusupdatemovie.co.uk,tt5692390,106,0,416178,4.9578,7.28,567,2018-02-09,False,False,/E4twRNScyq3g6tRpvK6X8LdD1z.jpg,/qegwTsiVjrNY9nwkwzLJQ5r4204.jpg,,,Scott Speer,2026-04-20 18:16:14.992048
668461,Slumberland,Slumberland,en,"A young girl discovers a secret map to the dreamworld of Slumberland, and with the help of an eccentric outlaw, she traverses dreams and flees nightmares, with the hope that she will be able to see her late father again.",Every adventure begins with a dream.,Released,https://www.netflix.com/title/81220825,tt13320662,117,35000000,0,6.5834,7.279,927,2022-11-18,False,False,/eCgBLNAFC4XDZ4DiyQ80PIJdSHU.jpg,/6tAYyCxF0T5oUIH95zMBC3X3W5T.jpg,,,Francis Lawrence,2026-04-20 18:16:15.381054
1147400,"Miraculous World: Paris, Tales of Shadybug and Claw Noir","Miraculous World : Paris, Les Aventures de Toxinelle et Griffe Noire",fr,"Miraculous holders from another world appear in Paris. They come from a parallel universe where everything is reversed: the holders of Ladybug and Black Cat Miraculouses, Shadybug and Claw Noir, are the bad guys, and the holder of the Butterfly Miraculous, Betterfly, is a superhero. Ladybug and Cat Noir will have to help Betterfly counter the attacks of their evil doubles and prevent them from seizing the Butterfly Miraculous. Can our heroes also help Betterfly make Shadybug and Claw Noir better people?",It only takes one decision to become a hero.,Released,,tt29259099,46,0,0,5.6184,7.275,625,2023-10-21,False,False,/7Md3nuV0ZprBTnkdR3OrUCEsrSP.jpg,/hU1Q9YVzdYhokr8a9gLywnSUMlN.jpg,822306,Miraculous World,Thomas Astruc,2026-04-20 18:16:15.742202
13597,Labyrinth,Labyrinth,en,"Frustrated with babysitting on yet another weekend night, Sarah, a teenager with an active imagination, summons the Goblins to take her baby stepbrother away. When little Toby actually disappears, Sarah must follow him into a fantastical world to rescue him from the Goblin King. Guarding his castle is the labyrinth itself, a twisted maze of deception, populated with outrageous characters and unknown dangers.",Where everything seems possible and nothing is what it seems.,Released,,tt0091369,101,25000000,12729917,9.2912,7.275,2709,1986-06-27,False,False,/hbSdA1DmNA9IlfVoqJkIWYF2oYm.jpg,/92tb8mgjgL1S2KwrZezyPHPkQ3R.jpg,,,Jim Henson,2026-04-20 18:16:16.114049
323661,Mune: Guardian of the Moon,"Mune, le gardien de la lune",fr,"When a faun named Mune becomes the Guardian of the Moon, little did he had unprepared experience with the Moon and an accident that could put both the Moon and the Sun in danger, including a corrupt titan named Necross who wants the Sun for himself and placing the balance of night and day in great peril. Now with the help of a wax-child named Glim and the warrior, Sohone who also became the Sun Guardian, they go out on an exciting journey to get the Sun back and restore the Moon to their rightful place in the sky.",,Released,,tt3858372,86,17000000,15730665,3.1097,7.273,593,2015-02-05,False,False,/fWjm8AH9YqkRUR2yf4y1mDIvj0O.jpg,/oqblGh9vRXFBV9Auu8St5i50njr.jpg,,,Benoît Philippon,2026-04-20 18:16:16.563552
438148,Minions: The Rise of Gru,Minions: The Rise of Gru,en,"A fanboy of a supervillain supergroup known as the Vicious 6, Gru hatches a plan to become evil enough to join them, with the backup of his followers, the Minions.",A villain will rise.,Released,https://www.minionsmovie.com/,tt5113044,87,85000000,940203765,12.5474,7.27,3988,2022-06-29,False,False,/wKiOkZTN9lUUUNZLmtnwubZYONg.jpg,/wZS4xSfPtk1NPQnx9zsT5R2WhCu.jpg,544669,Minions Collection,Kyle Balda,2026-04-20 18:16:16.992839
590223,Love and Monsters,Love and Monsters,en,"Seven years since the Monsterpocalypse began, Joel Dawson has been living underground in order to survive. But after reconnecting over radio with his high school girlfriend Aimee, Joel decides to venture out to reunite with her, despite all the dangerous monsters that stand in his way.",An apocalyptic love story.,Released,https://www.paramountmovies.com/movies/love-and-monsters,tt2222042,109,30000000,1122066,8.7629,7.269,4410,2020-10-16,False,False,/718NnyxyQuBQcGWt9sdelA1Zc3h.jpg,/lA5fOBqTOQBQ1s9lEYYPmNXoYLi.jpg,,,Michael Matthews,2026-04-20 18:16:17.431899
2657,Pleasantville,Pleasantville,en,"Geeky teenager David and his popular twin sister, Jennifer, get sucked into the black-and-white world of a 1950s TV sitcom called ""Pleasantville,"" and find a world where everything is peachy keen all the time. But when Jennifer's modern attitude disrupts Pleasantville's peaceful but boring routine, she literally brings color into its life.",Nothing is as simple as black and white.,Released,,tt0120789,124,60000000,49800000,5.4413,7.267,1855,1998-09-17,False,False,/m1hhYP6OScjKU5Z9iZaWirSn4I6.jpg,/kYRMXDkV9cZO7xeuSzMvsyky8EK.jpg,,,Gary Ross,2026-04-20 18:16:17.895655
285,Pirates of the Caribbean: At World's End,Pirates of the Caribbean: At World's End,en,"After losing Captain Jack Sparrow to the locker of Davy Jones, Will Turner, Elizabeth Swann, and Captain Barbossa journey to the ends of the earth to rescue him. And as the East India Trading Company tightens its grip on the seas under Lord Cutler Beckett—now in control of Davy Jones—the fate of piracy hangs by a thread. Now, they must unite the pirate lords for one final stand. But as loyalties are tested and alliances shift, each must ultimately choose where they stand in the battle for freedom on the high seas.","At the end of the world, the adventure begins.",Released,https://movies.disney.com/pirates-of-the-caribbean-at-worlds-end,tt0449088,169,300000000,961691209,17.1393,7.266,15354,2007-05-19,False,False,/jGWpG4YhpQwVmjyHEGkxEkeRf0S.jpg,/1jHxkVXMI5s3vRiyiZooUy1shB5.jpg,295,Pirates of the Caribbean Collection,Gore Verbinski,2026-04-20 18:16:18.293738
436343,On Body and Soul,Testről és lélekről,hu,"Two introverted people find out by pure chance that they share the same dream every night. They are puzzled, incredulous, a bit frightened. As they hesitantly accept this strange coincidence, they try to recreate in broad daylight what happens in their dream.",We meet at night. In our dreams.,Released,,tt5607714,116,0,0,1.4954,7.264,607,2017-03-02,False,False,/uguWEoZelSSckxgiQctlkZ6gpfU.jpg,/s5BvDOLava3Z8NjAOnT0Xe96iLS.jpg,,,Ildikó Enyedi,2026-04-20 18:16:19.112681
766,Army of Darkness,Army of Darkness,en,"Ash, a handsome, shotgun-toting, chainsaw-armed department store clerk, is time warped backwards into England's Dark Ages, where he romances a beauty and faces legions of the undead.",Trapped in time. Surrounded by evil. Low on gas.,Released,,tt0106308,81,11000000,21502976,7.7216,7.263,3485,1992-10-31,False,False,/xsgTuAtR2zSH8Umg3jWZcZjlDpe.jpg,/5RPXs9g0sZ9Woo4pNLxdXdge7tc.jpg,1960,Evil Dead Collection,Sam Raimi,2026-04-20 18:16:19.483673
34134,Barbie in A Mermaid Tale,Barbie in A Mermaid Tale,en,"Barbie stars as Merliah, a surfer who learns a shocking secret: she's a mermaid! She and her dolphin friend set out for an undersea adventure to rescue her mother, the queen of Oceana.",Barbie Makes A Big Splash!,Released,,tt1610301,75,0,16441438,5.2068,7.3,806,2010-01-25,False,False,/jtOlo3AaXVBnqfMeKGFrZUMPFui.jpg,/csSEukCACMBPgqDgujDBHG4bfpj.jpg,422361,Barbie A Mermaid Tale Collection,Adam Wood,2026-04-20 18:16:19.998764
10150,The Last Unicorn,The Last Unicorn,en,"A unicorn learns from a riddle-speaking butterfly that she is supposedly the last of her kind, all the others having been herded away by the monstrous Red Bull. The unicorn sets out to discover the truth behind the butterfly's words. She is eventually joined on her quest by Schmendrick, a second-rate magician, and Molly Grue, a middle-aged woman who dreamed all her life of seeing a unicorn. Their journey leads them far from home, all the way to the castle of King Haggard.",There's magic in believing!,Released,,tt0084237,93,0,6455530,7.0208,7.26,583,1982-11-19,False,False,/MRHFtXTjxC74MGCzHACcuqvHiw.jpg,/fwxOQkzYtRVKs3kzcyukdbsyIuh.jpg,,,Jules Bass,2026-04-20 18:16:20.318407
779,Vampyr,Vampyr - Der Traum des Allan Grey,de,"Allan Gray, a young man fascinated by the supernatural, goes to a small village where he feels a sinister force descending upon him. There, Allan meets an old man who asks him to protect his two daughters, for one of them has been bitten by a vampire.",The strange adventure of Allan Gray.,Released,,tt0023649,74,0,19,1.7239,7.26,586,1932-05-06,False,False,/yt3JS5JSoZseSohYkhs6FLU9B0O.jpg,/rg3hBiQbDet8uNQkgfbpk7306p8.jpg,,,Carl Theodor Dreyer,2026-04-20 18:16:20.741340
571468,Freaks Out,Freaks Out,it,Four super-powered circus freaks find themselves trapped in war-torn Rome after their foster father is captured by the Nazis.,,Released,,tt7270808,141,12000000,3279079,1.7272,7.257,951,2021-10-28,False,False,/6y0qa5rkSMuTmOPyQZ8u0g1VeEF.jpg,/rTVUx5xLnMyeRPYRcZd8XPzSekJ.jpg,,,Gabriele Mainetti,2026-04-20 18:16:21.137665
10501,The Road to El Dorado,The Road to El Dorado,en,"Stowing away after a failed con, a pair of swindlers end up on El Dorado, the fabled ""city of gold"", where they quickly get in over their heads when they are mistaken as gods by the inhabitants.",They came for the gold. They stayed for the adventure.,Released,,tt0138749,89,95000000,76400000,10.8438,7.256,4015,2000-03-31,False,False,/tQuqhUBACMcGqCvliHxpJreBfXC.jpg,/ciM5RFsBoWEj0tbwJy42Hr76iRd.jpg,,,Bibo Bergeron,2026-04-20 18:16:21.498871
483980,Z-O-M-B-I-E-S,Z-O-M-B-I-E-S,en,"Two star-crossed freshmen – a zombie, Zed and a cheerleader, Addison – each outsiders in their unique ways, befriend each other and work together to show their high school and the Seabrook community what they can achieve when they embrace their differences.","At Seabrook High, it's Zoms vs. Poms",Released,,tt6878820,94,0,0,6.1708,7.3,764,2018-02-16,False,False,/6S9O5U7Ietqh6zTtZhGbhbA3Pze.jpg,/ArccbTKFk8fMp5JnHuxoW8xU0iJ.jpg,683698,Z-O-M-B-I-E-S Collection,Paul Hoen,2026-04-20 18:16:21.888870
923939,The Wonderful Story of Henry Sugar,The Wonderful Story of Henry Sugar,en,A rich man learns about a guru who can see without using his eyes. He sets out to master the skill in order to cheat at gambling.,,Released,https://www.netflix.com/title/81388090,tt16968450,39,0,0,5.2705,7.251,1360,2023-09-20,False,False,/fDUywEHwHh6nsLnVXAdPN9m4ZUG.jpg,/dS4JR8gmj8UnamjuLEyAkEFoppy.jpg,,,Wes Anderson,2026-04-20 18:16:22.210661
109445,Frozen,Frozen,en,"Young princess Anna of Arendelle dreams about finding true love at her sister Elsa’s coronation. Fate takes her on a dangerous journey in an attempt to end the eternal winter that has fallen over the kingdom. She's accompanied by ice delivery man Kristoff, his reindeer Sven, and snowman Olaf. On an adventure where she will find out what friendship, courage, family, and true love really means.",Who will save the day? The ice guy? The nice guy? The snow man? Or no man?,Released,http://movies.disney.com/frozen,tt2294629,102,150000000,1274219009,20.2513,7.248,17491,2013-11-20,False,False,/itAKcobTYGpYT8Phwjd8c9hleTo.jpg,/rj58WQ9ImI0mYDptXdM7euX1Wjt.jpg,386382,Frozen Collection,Chris Buck,2026-04-20 18:16:22.703690
901362,Trolls Band Together,Trolls Band Together,en,"When Branch's brother, Floyd, is kidnapped for his musical talents by a pair of nefarious pop-star villains, Branch and Poppy embark on a harrowing and emotional journey to reunite the other brothers and rescue Floyd from a fate even worse than pop-culture obscurity.",There are some new trolls on the block.,Released,https://www.dreamworks.com/movies/trolls-band-together,tt14362112,91,95000000,210231405,10.1088,7.246,973,2023-10-12,False,False,/3ySgD2xwasTHOK6R9bNZiEwKgYo.jpg,/mDW6z7I6de6JbUgPOkAEZwKbg7G.jpg,489724,The Trolls Collection,Walt Dohrn,2026-04-20 18:16:23.466483
79707,Children Who Chase Lost Voices,星を追う子ども,ja,"The film centers on Asuna, a young girl who spends her solitary days listening to the mysterious music emanating from the crystal radio she received from her late father as a memento. One day while walking home she is attacked by a fearsome monster and saved by a mysterious boy named Shun. However, Shun disappears and Asuna embarks on a journey of adventure to the land of Agartha with her teacher Mr. Morisaki to meet a Shun again. Through her journey she comes to know the cruelty and beauty of the world, as well as loss.",A journey to say goodbye.,Released,,tt1839494,116,0,0,4.2583,7.246,774,2011-05-07,False,False,/hWyBwsjMgtuZL2i1QBWQY0OCh0M.jpg,/r3ibKnJ3qZvcm42OleT0HlcRDUk.jpg,,,Makoto Shinkai,2026-04-20 18:16:23.850713
8844,Jumanji,Jumanji,en,"When siblings Judy and Peter discover an enchanted board game that opens the door to a magical world, they unwittingly invite Alan -- an adult who's been trapped inside the game for 26 years -- into their living room. Alan's only hope for freedom is to finish the game, which proves risky as all three find themselves running from giant rhinoceroses, evil monkeys and other terrifying creatures.",It's a jungle in here.,Released,http://www.sonypictures.com/movies/jumanji/,tt0113497,104,65000000,262821940,3.5332,7.244,11227,1995-12-15,False,False,/vgpXmVaVyUL7GGiDeiK1mKEKzcX.jpg,/qSxeCfWUUyht9hZgaaYmtPtTkw2.jpg,495527,Jumanji Collection,Joe Johnston,2026-04-20 18:16:24.261076
75258,Secret of the Wings,Secret of the Wings,en,Tinkerbell wanders into the forbidden Winter woods and meets Periwinkle. Together they learn the secret of their wings and try to unite the warm fairies and the winter fairies to help Pixie Hollow.,Two Worlds. One Magical Secret.,Released,,tt1217213,75,0,0,7.5365,7.242,1350,2012-08-17,False,False,/aPudKEzwwmwc5lS8sdxvG3WX86t.jpg,/2AeE4Op9qjDSXe8GbfCtlbHFxhL.jpg,315595,Tinker Bell Collection,Peggy Holmes,2026-04-20 18:16:24.873003
902,The City of Lost Children,La Cité des enfants perdus,fr,"A scientist in a surrealist society kidnaps children to steal their dreams, hoping that they slow his aging process.",Where happily ever after is just a dream.,Released,,tt0112682,112,18000000,1738611,3.7424,7.24,1206,1995-05-17,False,False,/whwT3Q9JxbAYzEc3t7uYYcCbTMf.jpg,/f5ynCAQ1MuDgwoVyjouTw6UgK1l.jpg,,,Jean-Pierre Jeunet,2026-04-20 18:16:25.260918
465136,Every Day,Every Day,en,"16-year old Rhiannon falls in love with a mysterious spirit named “A” that inhabits a different body every day. Feeling an unmatched connection, Rhiannon and “A” work each day to find each other, not knowing what the next day will bring.",Every day a different body. Every day a different life. Every day in love with the same girl.,Released,http://www.seeeveryday.com/,tt7026672,97,4900000,10400000,5.5366,7.24,2293,2018-02-22,False,False,/4UnME3icxSspwL0UoGZNSyyp7Xs.jpg,/wEXYJgW5l2IwwNdRVk9ixgKl8qu.jpg,,,Michael Sucsy,2026-04-20 18:16:25.871285
446893,Trolls World Tour,Trolls World Tour,en,"Queen Poppy and Branch make a surprising discovery — there are other Troll worlds beyond their own, and their distinct differences create big clashes between these various tribes. When a mysterious threat puts all of the Trolls across the land in danger, Poppy, Branch, and their band of friends must embark on an epic quest to create harmony among the feuding Trolls to unite them against certain doom.",Happiest. Movie. Ever.,Released,https://www.dreamworks.com/movies/trolls-world-tour,tt6587640,91,90000000,49276818,9.2488,7.239,2257,2020-03-11,False,False,/7W0G3YECgDAfnuiHG91r8WqgIOe.jpg,/qsxhnirlp7y4Ae9bd11oYJSX59j.jpg,489724,The Trolls Collection,Walt Dohrn,2026-04-20 18:16:26.291878
113082,Berserk: The Golden Age Arc I - The Egg of the King,ベルセルク 黄金時代篇I 覇王の卵,ja,"Guts, an immensely strong sword-for-hire, has little direction in his life, simply fighting one battle after the next. However, this all changes suddenly when he meets and is bested by Griffith, a beautiful and charismatic young man who leads the Band of the Hawk mercenary army. After Guts joins the Band and the relationship between the two men begins to blossom, Casca, the tough, lone swordswoman in the Band of the Hawk, struggles to accept Guts and the influence he has on the world around her.  While the two men begin to fight together, Griffith continues to rise to power, all seemingly in order to reach his mysterious, prophesied goals. What lengths will Guts and Griffith go to in order to reach these goals, and where will fate take the two men?","He trusts no one, only his sword.",Released,,tt2210479,76,0,2152610,4.241,7.238,537,2012-02-04,False,False,/xhF4dIVacYuQ2o7Wq4xOU8JCGgO.jpg,/v7GQxa9ZmdMZjt4JwZF54mvAiTv.jpg,118415,Berserk: The Golden Age Arc Collection,Toshiyuki Kubooka,2026-04-20 18:16:26.854385
399055,The Shape of Water,The Shape of Water,en,"An other-worldly story, set against the backdrop of Cold War era America circa 1962, where a mute janitor working at a lab falls in love with an amphibious man being held captive there and devises a plan to help him escape.",A fairy tale for troubled times.,Released,https://www.searchlightpictures.com/theshapeofwater,tt5580390,123,19500000,195300000,10.5853,7.236,12791,2017-12-01,False,False,/9zfwPffUXpBrEP26yp0q1ckXDcj.jpg,/abirSHwWgKajV3hXhaIR5lcCIXe.jpg,,,Guillermo del Toro,2026-04-20 18:16:27.206424
330457,Frozen II,Frozen II,en,"Elsa, Anna, Kristoff and Olaf head far into the forest to learn the truth about an ancient mystery of their kingdom.",The past is not what it seems.,Released,https://movies.disney.com/frozen-2,tt4520988,103,150000000,1453683476,14.3536,7.233,10230,2019-11-20,False,False,/mINJaa34MtknCYl5AjtNJzWj8cD.jpg,/AoSZyb37ljMAxw0RdeQEBHKtgcc.jpg,386382,Frozen Collection,Jennifer Lee,2026-04-20 18:16:27.724116
251,Ghost,Ghost,en,"After a young man is murdered, his spirit stays behind to warn his lover of impending danger, with the help of a reluctant psychic.","Before Sam was murdered, he told Molly he'd love and protect her forever.",Released,,tt0099653,127,22000000,505000000,11.997,7.2,5976,1990-07-13,False,False,/w9RaPHov8oM5cnzeE27isnFMsvS.jpg,/6nLdSON3ErniBZTXWG7WRqs5jGz.jpg,,,Jerry Zucker,2026-04-20 18:16:28.257654
268,Batman,Batman,en,"Having witnessed his parents' brutal murder as a child, millionaire philanthropist Bruce Wayne fights crime in Gotham City disguised as Batman, a costumed hero who strikes fear into the hearts of villains. But when a deformed madman known as 'The Joker' seizes control of Gotham's criminal underworld, Batman must face his most ruthless nemesis ever while protecting both his identity and his love interest, reporter Vicki Vale.",Justice is always darkest before the dawn.,Released,,tt0096895,126,35000000,411348924,11.7481,7.229,8503,1989-06-21,False,False,/cij4dd21v2Rk2YtUQbV5kW69WB2.jpg,/zlsaQEE26TS34ziXAiNIAqa0MLX.jpg,120794,Batman Collection,Tim Burton,2026-04-20 18:16:28.728280
899112,Violent Night,Violent Night,en,"When a team of mercenaries breaks into a wealthy family compound on Christmas Eve, taking everyone inside hostage, the team isn’t prepared for a surprise combatant: Santa Claus is on the grounds, and he’s about to show why this Nick is no saint.",You better watch out.,Released,https://www.violentnightmovie.com,tt12003946,111,20000000,75734910,7.5744,7.227,2521,2022-11-30,False,False,/e8CpMgdyihz9Td7amQDqubPuzfN.jpg,/sBOenwOZGRN5nZZGw4TxwtnfrEf.jpg,1078456,Violent Night Collection,Tommy Wirkola,2026-04-20 18:16:29.250468
453395,Doctor Strange in the Multiverse of Madness,Doctor Strange in the Multiverse of Madness,en,"Doctor Strange, with the help of mystical allies both old and new, traverses the mind-bending and dangerous alternate realities of the Multiverse to confront a mysterious new adversary.",Enter a new dimension of Strange.,Released,https://www.marvel.com/movies/doctor-strange-in-the-multiverse-of-madness,tt9419884,126,290000000,955775804,19.1796,7.225,10212,2022-05-04,False,False,/ddJcSKbcp4rKZTmuyWaMhuwcfMz.jpg,/AdyJH8kDm8xT8IKTlgpEC15ny4u.jpg,618529,Doctor Strange Collection,Sam Raimi,2026-04-20 18:16:29.674990
16646,Russian Ark,Русский ковчег,ru,"A ghost and a French marquis wander through the Winter Palace in St Petersburg, encountering scenes from many different periods of its history.","2000 cast members, 3 orchestras, 33 rooms, 300 years, ALL IN ONE TAKE",Released,,tt0318034,99,0,6723732,1.5902,7.225,504,2002-05-22,False,False,/dkFM8Q7J0wNpEnbtD1AcWumkShj.jpg,/lLQgQy1nX3qocg83BLTCz1911R4.jpg,,,Aleksandr Sokurov,2026-04-20 18:16:30.613963
9078,The Sword in the Stone,The Sword in the Stone,en,"Wart is a young boy who aspires to be a knight's squire. On a hunting trip he falls in on Merlin, a powerful but amnesiac wizard who has plans for him beyond mere squiredom. He starts by trying to give him an education, believing that once one has an education, one can go anywhere. Needless to say, it doesn't quite work out that way.",Tired of living in a Medieval mess... Merlin uses all his magic powers to change a scrawny little boy into a legendary hero!,Released,,tt0057546,79,3000000,22200000,8.5708,7.219,4077,1963-12-25,False,False,/7lyeeuhGAJSNXYEW34S8mJ1bwI8.jpg,/uMe6McFXAPEhkasGVlaLTOuhfnl.jpg,,,Wolfgang Reitherman,2026-04-20 18:16:31.113153
116745,The Secret Life of Walter Mitty,The Secret Life of Walter Mitty,en,A timid magazine photo manager who lives life vicariously through daydreams embarks on a true-life adventure when a negative goes missing.,Stop dreaming. Start living.,Released,https://www.20thcenturystudios.com/movies/the-secret-life-of-walter-mitty,tt0359950,114,90000000,188133322,8.1034,7.218,8186,2013-12-18,False,False,/iAo1hlzsPV9XpYcLQp6Ud065tGO.jpg,/pzMrxeP9XkKOtQVUBPTq5yk4ck5.jpg,,,Ben Stiller,2026-04-20 18:16:31.451053
5590,Donkey Skin,Peau d'âne,fr,A fairy godmother helps a princess disguise herself so she won't have to marry her father.,The skin of an animal hid her captivating beauty that only a prince could discover!,Released,,tt0066207,90,0,13200000,2.9049,7.219,546,1970-12-16,False,False,/kSODEFNpTBCOJNHhsbwrwvH0Uvd.jpg,/3yZva3ONs7C1kKJ6IVvrZQJCUIj.jpg,,,Jacques Demy,2026-04-20 18:16:32.041554
34584,The NeverEnding Story,Die unendliche Geschichte,de,"While hiding from bullies in his school's attic, a young boy discovers the extraordinary land of Fantasia, through a magical book called The Neverending Story. The book tells the tale of Atreyu, a young warrior who, with the help of a luck dragon named Falkor, must save Fantasia from the destruction of The Nothing.",A boy who needs a friend finds a world that needs a hero in a land beyond imagination!,Released,,tt0088323,97,27000000,20158808,7.019,7.215,4342,1984-04-06,False,False,/lWJC8om086h01f0CMGR9ombdpnI.jpg,/77Lxx8CkJ5KhiwLb0mJqN7coubk.jpg,91430,The NeverEnding Story Collection,Wolfgang Petersen,2026-04-20 18:16:32.348392
10198,The Princess and the Frog,The Princess and the Frog,en,"A waitress, desperate to fulfill her dreams as a restaurant owner, is set on a journey to turn a frog prince back into a human being, but she has to face the same problem after she kisses him.",Every love story begins with a kiss...,Released,https://movies.disney.com/the-princess-and-the-frog,tt0780521,98,105000000,270997378,11.5655,7.214,6070,2009-12-08,False,False,/v6nAUs62OJ4DXmnnmPFeVmMz8H9.jpg,/y5tad0a4yRbxYgOHGllEIEeCCKt.jpg,,,Ron Clements,2026-04-20 18:16:32.752438
204436,Jack and the Cuckoo-Clock Heart,Jack et la mécanique du cœur,fr,"Jack is born with his heart frozen solid on the coldest day in history. A wise midwife saves him by replacing it with a cuckoo clock. Now Jack must abide by three rules to keep his mechanical heart safe: never touch the clock's hands, master his anger, and never fall in love. He tries his best, but when he meets a girl named Acacia he falls in love, threatening the delicate balance of his artificial heart.","He must never touch the hands of the clock. He must master his anger. He must never, ever fall in love.",Released,,tt1181840,94,33746302,3484370,2.7372,7.212,754,2014-01-29,False,False,/ZSrU2mvlzM5Jr30XtKCU1fziIj.jpg,/rjXK74vrvmFMN0vuFw3TViZ18Ha.jpg,,,Stéphane Berla,2026-04-20 18:16:33.203095
